,Neighborhood,Price,Bedrooms,Bathrooms,House Size,Description,Neighborhood Description
0, Pacific Palisades," $3,500,000", 4, 3.5," 3,500 sqft"," This stunning modern home in the sought-after community of Pacific Palisades features an open floor plan with high ceilings and floor-to-ceiling windows, offering breathtaking ocean views. The 4-bedroom, 3.5-bathroom home boasts luxurious finishes and top-of-the-line appliances. The spacious backyard is perfect for entertaining, with a pool and outdoor kitchen. Enjoy the coastal lifestyle in this luxurious Pacific Palisades home."," Pacific Palisades is a premier coastal community known for its beautiful beaches, hiking trails, and high-end shops and restaurants. The neighborhood has top-rated schools and is just a short drive from popular attractions like the Santa Monica Pier and Malibu. Experience the best of California living in Pacific Palisades."
1, Hollywood Hills," $2,500,000", 5, 4," 3,500 sqft"," Experience luxury living in this stunning 5-bedroom, 4-bathroom modern home in the heart of Hollywood Hills. The sleek and contemporary design features high-end finishes, state-of-the-art appliances, and floor-to-ceiling windows showcasing breathtaking views of the city. The spacious open-concept layout is perfect for entertaining, with a gourmet chef's kitchen, expansive rooftop deck, and infinity pool. Live like a celebrity in this Hollywood Hills gem."," The Hollywood Hills is a highly desirable neighborhood with a mix of old Hollywood glamour and modern luxury. Enjoy easy access to top-rated restaurants, upscale shopping, and iconic landmarks such as the Hollywood Sign and Griffith Observatory. This exclusive neighborhood offers privacy and seclusion while still being just a short drive away from the bustling city life of Los Angeles."
2, Ladera Ranch," $1,200,000", 4, 3," 3,500 sqft"," This stunning 4-bedroom, 3-bathroom home is located in the highly sought-after community of Ladera Ranch. With over 3,500 square feet of living space, this home features high ceilings, a spacious kitchen with granite countertops, and a luxurious master suite. The backyard is an entertainer's dream with a pool, spa, and built-in BBQ area. Enjoy resort-style living with access to community amenities such as pools, parks, and hiking trails."," Ladera Ranch is a family-friendly community located in the heart of Orange County. With a tight-knit community feel and top-rated schools, it is the perfect place to call home. Residents can enjoy numerous community events, outdoor activities, and easy access to shopping and dining options. Ladera Ranch offers the perfect combination of suburban living and convenience."
3, Manhattan Beach," $2,500,000", 5, 3.5," 3,500 sqft"," This stunning 5-bedroom, 3.5-bathroom home in Manhattan Beach embraces the California beach lifestyle. With high-end finishes and plenty of natural light, this home exudes luxury and comfort. The spacious backyard features a pool, hot tub, and outdoor kitchen, perfect for entertaining. Enjoy ocean views from the rooftop deck or take a short walk to the nearby beach and shops. Live your best life in this beachside haven."," Manhattan Beach is a highly sought-after coastal community known for its beautiful beaches, upscale dining and shopping, and top-rated schools. With a strong sense of community and a variety of outdoor activities, this neighborhood has something for everyone. Plus, with its convenient location near major highways and airports, this is the perfect location for those who commute or love to travel. Come experience the California lifestyle in Manhattan Beach."
4, Santa Monica," $1,500,000", 4, 3," 2,500 sqft"," This stunning Mediterranean-style home in Santa Monica offers the perfect blend of luxury and comfort. Boasting 4 bedrooms and 3 bathrooms, this spacious home features high-end finishes, hardwood floors, and a gourmet kitchen with top-of-the-line appliances. Relax in the backyard oasis with a pool and hot tub, perfect for entertaining. With its prime location just minutes away from the beach, shopping, and dining, this Santa Monica gem is the ultimate California dream home."," Santa Monica is a desirable beachfront city known for its laid-back yet chic lifestyle. With its famous Santa Monica Pier and Third Street Promenade, residents can enjoy a variety of entertainment and dining options. The city also offers a variety of outdoor activities, from surfing and biking to hiking in nearby Santa Monica Mountains. With its warm climate and vibrant community, Santa Monica is the perfect place to call home."
5, West Hollywood," $1,500,000", 4, 3," 2,500 sqft"," Live in luxury in the heart of West Hollywood in this stunning 4-bedroom, 3-bathroom home. With high-end finishes and modern amenities, this home is perfect for entertaining. Enjoy the California sunshine in the spacious backyard complete with a pool and outdoor kitchen. The open-concept living and dining area boasts floor-to-ceiling windows, bringing in plenty of natural light and offering panoramic views of the city. Don't miss out on your chance to own a piece of West Hollywood real estate paradise."," West Hollywood is known for its vibrant nightlife, fashionable boutiques, and trendy restaurants. With easy access to both the beach and the bustling city, this neighborhood is the perfect mix of laid-back California vibes and city living. Enjoy the many parks and outdoor spaces, or catch a show at the iconic Troubadour music venue. This neighborhood has something for everyone."
6, Beverly Hills," $5,500,000", 5, 6," 4,200 sqft"," Located in the prestigious Beverly Hills neighborhood, this luxurious 5-bedroom, 6-bathroom estate offers the ultimate California lifestyle. The grand entrance leads to a spacious living room with floor-to-ceiling windows showcasing panoramic views of the city. The gourmet kitchen features high-end appliances and a large island, perfect for entertaining. The backyard oasis includes a pool, spa, and outdoor dining area. This elegant home is the epitome of California luxury."," Beverly Hills is known for its upscale shopping, dining, and celebrity sightings. The neighborhood offers easy access to top-rated schools, parks, and cultural attractions such as the Getty Museum. With a mild climate and stunning views, it's no wonder that Beverly Hills is a highly desirable place to call home."
7, Los Feliz," $1,200,000", 4, 3," 2,500 sqft"," Located in the highly desirable neighborhood of Los Feliz, this stunning 4-bedroom, 3-bathroom home offers both luxury and convenience. With its modern design and top-of-the-line appliances, this home is perfect for entertaining. The spacious living area opens up to a private backyard with a sparkling pool, perfect for soaking up the California sunshine. Retreat to the master suite with a spa-like bathroom and walk-in closet for the ultimate in relaxation."," Los Feliz is known for its trendy restaurants, boutique shops, and historic attractions. Enjoy a leisurely hike at Griffith Park or take in a show at the iconic Greek Theater. With its central location, you'll have easy access to all that Los Angeles has to offer. Don't miss the opportunity to live in this highly sought-after neighborhood."
8, Beverly Hills," $5,500,000", 5, 6," 5,000 sqft"," Welcome to luxurious living in Beverly Hills. This stunning 5-bedroom, 6-bathroom home boasts high-end finishes and luxurious amenities throughout. The grand foyer leads to a spacious living room with soaring ceilings and a fireplace, perfect for entertaining guests. The gourmet kitchen features top-of-the-line appliances and a large island, ideal for the avid chef. Relax in the master suite, complete with a spa-like bathroom and walk-in closet. The backyard oasis includes a pool, spa, and outdoor kitchen. Live in the lap of luxury in this Beverly Hills dream home."," Beverly Hills is known for its luxurious lifestyle and prestigious homes. Enjoy the finest dining, shopping, and entertainment just minutes from your doorstep. With easy access to major highways and a short drive to the beach, this highly sought-after neighborhood offers the perfect combination of privacy and convenience. "
9, Beverly Hills," $5,000,000", 6, 8," 6,000 sqft"," Experience luxury living in this stunning 6-bedroom, 8-bathroom estate in prestigious Beverly Hills. The grand entrance leads to a spacious living area boasting high ceilings and marble floors. The gourmet kitchen features top-of-the-line appliances and overlooks the expansive backyard with a sparkling pool and outdoor entertainment area. The master suite boasts a luxurious bathroom and walk-in closet. Enjoy the ultimate California lifestyle in this elegant Beverly Hills home."," Beverly Hills is the epitome of luxury living in California. With its lavish homes, high-end shopping, and exclusive restaurants, it's no wonder this neighborhood is a playground for the rich and famous. Take a drive down Rodeo Drive or enjoy a day of pampering at one of the many luxurious spas. The neighborhood also offers excellent schools and easy access to all the best that Los Angeles has to offer. "
